{
  "v": 1,
  "type": "HELLO",
  "msgId": "11111111-1111-4111-8111-111111111111",
  "ts": 1700000000000,
  "payload": {
    "deviceId": "22222222-2222-4222-8222-222222222222",
    "name": "MacBook Pro",
    "os": "macos",
    "protocolVersion": 1,
    "certFingerprint": "aaaaaaaaaaaaaaaaaaaaaaaaaaaaaaaaaaaaaaaaaaaaaaaaaaaaaaaaaaaaaaaa",
    "authNonce": "bbbbbbbbbbbbbbbbbbbbbbbbbbbbbbbb"
  }
}
